{
  "id": "sess-cr-20260310-b2e1",
  "phase": "active",
  "declaration": {
    "id": "decl-cr-20260310-a7f3",
    "session_id": "sess-cr-20260310-b2e1",
    "allowed_actions": [
      "read",
      "write",
      "search",
      "summarize"
    ],
    "allowed_tools": [
      "read_file",
      "list_files",
      "search_code",
      "post_comment",
      "request_changes",
      "approve_pr"
    ],
    "allowed_resources": [
      "github.com/acme/widget-api/pull/142",
      "github.com/acme/widget-api/tree/feat/auth-refactor"
    ],
    "allowed_resource_families": [
      "code",
      "documentation",
      "pull_request"
    ],
    "allowed_side_effects": [
      "none",
      "internal_write"
    ],
    "delegation_policy": {
      "max_depth": 1,
      "max_total_delegations": 2,
      "max_sibling_delegations": 1
    },
    "metadata": {
      "purpose": "Automated code review of authentication refactor PR",
      "owner": "platform-team@acme.com",
      "environment": "ci-review"
    },
    "created_at": "2026-03-10T09:00:00Z"
  },
  "events": [
    {
      "event_id": "evt-20260310-001",
      "session_id": "sess-cr-20260310-b2e1",
      "timestamp": "2026-03-10T09:01:12Z",
      "actor": "agent:code-reviewer-v3",
      "action_class": "read",
      "tool_name": "read_file",
      "target": "github.com/acme/widget-api/tree/feat/auth-refactor/src/auth/handler.go",
      "resource_family": "code",
      "content_class": "source_code",
      "summary": "Read authentication handler source to review token validation logic.",
      "side_effect_class": "none",
      "visibility": "full",
      "confidence_hint": 1.0
    },
    {
      "event_id": "evt-20260310-002",
      "session_id": "sess-cr-20260310-b2e1",
      "timestamp": "2026-03-10T09:02:45Z",
      "actor": "agent:code-reviewer-v3",
      "action_class": "search",
      "tool_name": "search_code",
      "target": "github.com/acme/widget-api/tree/feat/auth-refactor",
      "resource_family": "code",
      "content_class": "source_code",
      "summary": "Searched codebase for all callers of deprecated ValidateTokenLegacy function to assess migration completeness.",
      "side_effect_class": "none",
      "visibility": "full",
      "confidence_hint": 1.0
    },
    {
      "event_id": "evt-20260310-003",
      "session_id": "sess-cr-20260310-b2e1",
      "timestamp": "2026-03-10T09:04:30Z",
      "actor": "agent:code-reviewer-v3",
      "action_class": "write",
      "tool_name": "post_comment",
      "target": "github.com/acme/widget-api/pull/142",
      "resource_family": "pull_request",
      "summary": "Posted review comment on PR #142 noting that ValidateTokenLegacy is still called in 3 locations and should be migrated to the new ValidateToken function.",
      "side_effect_class": "internal_write",
      "visibility": "full",
      "confidence_hint": 1.0
    }
  ],
  "latest_decision": {
    "session_id": "sess-cr-20260310-b2e1",
    "state": "compliant",
    "findings": [],
    "recommended_action": "none",
    "events_processed": 3,
    "reconciliation_time": "2026-03-10T09:05:00Z"
  },
  "created_at": "2026-03-10T09:00:00Z",
  "updated_at": "2026-03-10T09:05:00Z"
}
